phenomenon,sentence_number,spa_eng_grammatical,spa_eng_ungrammatical,eng_spa_grammatical,eng_spa_ungrammatical
CompoundNPs,126,Consultó el codebook antes de ejecutar el script en el servidor de pruebas.,Consultó el book de códigos antes de ejecutar el script en el servidor de pruebas.,She referenced the book de códigos to ensure the script used correct keys.,She referenced the codebook to ensure the script used correct keys.
CompoundNPs,127,Dejó el notepad junto al teléfono por si llegaba alguna llamada urgente.,Dejó el notepad junto al book por si llegaba alguna llamada urgente.,He kept the book de notas by the phone in case of important calls.,He kept the notepad by the phone in case of important calls.
CompoundNPs,128,Subió el logfile al servidor para que el equipo lo revisara esta tarde.,Subió el logfile al book de registro para que el equipo lo revisara esta tarde.,They stored the book de registro in the archive after review.,They stored the logfile in the archive after review.
CompoundNPs,129,Consultó el datapad para comprobar los valores antes de firmar el documento.,Consultó el datapad con el book de datos para comprobar los valores antes de firmar.,She checked the book de datos before signing the final contract.,She checked the datapad before signing the final contract.
CompoundNPs,130,Abrió el codepad para copiar el fragmento necesario del script de prueba.,Abrió el codepad para copiar el fragmento del book necesario del script de prueba.,He referenced the book de códigos to copy the required snippet.,He referenced the codepad to copy the required snippet.
CompoundNPs,131,Marcó la tarea en el taskpad y la asignó al equipo de soporte.,Marcó la tarea en el taskpad y la puso en el book para asignar.,They added the task to the book de tareas and assigned it to support.,They added the task to the taskpad and assigned it to support.
CompoundNPs,132,Escribió la idea en el planpad antes de la reunión con el cliente.,Escribió la idea en el planpad antes de la reunión con el cliente.,She noted the idea in the book de planes before the client meeting.,She noted the idea in the planpad before the client meeting.
CompoundNPs,133,Abrió el notebook para tomar notas durante la reunión de seguimiento.,Abrió el notebook para tomar notas en el book durante la reunión de seguimiento.,He used the book de notas to record key points from the meeting.,He used the notebook to record key points from the meeting.
CompoundNPs,134,Anotó la observación en el log2 antes de cerrar el laboratorio por la noche.,Anotó la observación en el book de registro antes de cerrar el laboratorio por la noche.,They entered the observation in the book de registro before closing the lab.,They entered the observation in the log2 before closing the lab.
CompoundNPs,135,Revisaron el plan2 antes de aprobar la fase siguiente del proyecto conjunto.,Revisaron el plan2 antes de aprobar la fase siguiente del proyecto conjunto.,They checked the book de planes before approving the next project phase.,They checked the plan2 before approving the next project phase.
CompoundNPs,136,Actualizó el scorelog con los puntos al terminar el partido de la tarde.,Actualizó el scorelog con los puntos en el book al terminar el partido de la tarde.,They recorded the points in the book de puntuaciones after the match.,They recorded the points in the scorelog after the match.
CompoundNPs,137,Subieron el databook al servidor para que el equipo lo analizara mañana.,Subieron el databook al servidor con el book de datos para que lo analizaran mañana.,They uploaded the book de datos to the server for team analysis tomorrow.,They uploaded the databook to the server for team analysis tomorrow.
CompoundNPs,138,Guardó el codefile en la carpeta del repositorio antes de hacer commit.,Guardó el codefile en la carpeta con el book de códigos antes de hacer commit.,He pushed the book de códigos to the repository for review.,He pushed the codefile to the repository for review.
CompoundNPs,139,Adjuntó el taskfile al correo para que el equipo lo revisara esta tarde.,Adjuntó el taskfile al correo con el book de tareas para que lo revisaran.,They attached the book de tareas to the email for the team to review.,They attached the taskfile to the email for the team to review.
CompoundNPs,140,Guardó el planfile en la carpeta compartida del proyecto antes de la reunión.,Guardó el planfile en la carpeta con el book de planes antes de la reunión.,She placed the book de planes in the shared project folder for access.,She placed the planfile in the shared project folder for access.
CompoundNPs,141,Abrió el notebook3 para tomar notas durante la presentación del cliente.,Abrió el notebook3 para tomar notas en el book durante la presentación del cliente.,He used the book de notas to capture the client's main requests.,He used the notebook3 to capture the client's main requests.
CompoundNPs,142,Subió el logfile2 al sistema para que el equipo lo revisara mañana.,Subió el logfile2 al sistema con el book de registro para que lo revisaran mañana.,They stored the book de registro in the archive after the audit.,They stored the logfile2 in the archive after the audit.
CompoundNPs,143,Imprimió el datapaper y lo añadió al databook del proyecto para referencia.,Imprimió el datapaper y lo puso en el book de datos del proyecto para referencia.,They filed the datos impresos in the book de datos for future reference.,They filed the datapaper in the databook for future reference.
CompoundNPs,144,Anotó el error en el codejournal para investigarlo al día siguiente.,Anotó el error en el codejournal y lo dejó en el book para investigar.,He logged the bug in the book de códigos to investigate tomorrow morning.,He logged the bug in the codejournal to investigate tomorrow morning.
CompoundNPs,145,Escribió una nota en el tasknote para recordar la fecha límite próxima.,Escribió una nota en el tasknote para recordar la fecha límite en el book.,He left a reminder in the book de tareas to meet the upcoming deadline.,He left a reminder in the tasknote to meet the upcoming deadline.
CompoundNPs,146,El gerente actualizó el planlog2 con las nuevas fechas de entrega acordadas.,El gerente actualizó el planlog2 con las nuevas fechas en el book acordadas.,They entered the new deadlines in the book de planes after approval.,They entered the new deadlines in the planlog2 after approval.
CompoundNPs,147,Guardó el datapack junto al informe en la carpeta del proyecto compartido.,Guardó el datapack con los datos junto al book en la carpeta del proyecto.,They attached the datos al book de proyecto antes de enviar el correo.,They attached the datapack to the project folder before sending the email.
CompoundNPs,148,Abrió el codepad2 para copiar el fragmento necesario del script de prueba.,Abrió el codepad2 para copiar el fragmento del book necesario del script de prueba.,He referenced the book de códigos to copy the required snippet for testing.,He referenced the codepad2 to copy the required snippet for testing.
CompoundNPs,149,Registró el progreso en el tasklog2 antes de cerrar la sesión del sistema.,Registró el progreso en el tasklog2 en el book antes de cerrar la sesión del sistema.,They saved the progress in the book de tareas before logging out.,They saved the progress in the tasklog2 before logging out.
CompoundNPs,150,Archivó el reportlog con los documentos del mes en la carpeta central.,Archivó el reportlog con los documentos en el book de informes del mes.,They filed the book de informes in the archive after month-end closing.,They filed the reportlog in the archive after month-end closing.
CompoundNPs,151,Pon el novel en la mesa junto a la lámpara.,Pon el novel de ficción en la mesa junto a la lámpara.,The novel de ficción is on the table next to the lamp.,The novel is on the table next to the lamp.
CompoundNPs,152,Lee el poem antes de dormir esta noche.,Lee el poem de ficción antes de dormir esta noche.,The poem de ficción was short but very moving.,The poem was short but very moving.
CompoundNPs,153,Guarda el story en la estantería del salón.,Guarda el story de ficción en la estantería del salón.,The story de ficción was popular with the children.,The story was popular with the children.
CompoundNPs,154,Consulta el manual cuando tengas dudas sobre el equipo.,Consulta el manual de ficción cuando tengas dudas sobre el equipo.,The manual de ficción is stored in the office drawer.,The manual is stored in the office drawer.
CompoundNPs,155,Cierra el diary y ponlo en el cajón.,Cierra el diary de ficción y ponlo en el cajón.,The diary de ficción stayed locked in the desk.,The diary stayed locked in the desk.
CompoundNPs,156,Extiende el map sobre la mesa para ver la ruta.,Extiende el map de ficción sobre la mesa para ver la ruta.,The map de ficción shows places that do not exist.,The map shows places that do not exist.
CompoundNPs,157,Coloca el album en la vitrina del museo.,Coloca el album de ficción en la vitrina del museo.,The album de ficción contains staged photographs for the show.,The album contains staged photographs for the show.
CompoundNPs,158,Entrega el paper al profesor antes del viernes.,Entrega el paper de ficción al profesor antes del viernes.,The paper de ficción was discussed at the seminar.,The paper was discussed at the seminar.
CompoundNPs,159,Prepara el report para la reunión de la tarde.,Prepara el report de ficción para la reunión de la tarde.,The report de ficción was circulated among the staff.,The report was circulated among the staff.
CompoundNPs,160,Revisa el text y corrige los errores de formato.,Revisa el text de ficción y corrige los errores de formato.,The text de ficción needs a final proofread.,The text needs a final proofread.
CompoundNPs,161,Publica el article en la web mañana por la mañana.,Publica el article de ficción en la web mañana por la mañana.,The article de ficción attracted many online comments.,The article attracted many online comments.
CompoundNPs,162,Escribe el essay y envíalo antes del plazo.,Escribe el essay de ficción y envíalo antes del plazo.,The essay de ficción explores an imagined future society.,The essay explores an imagined future society.
CompoundNPs,163,Mira el catalog para elegir el producto correcto.,Mira el catalog de ficción para elegir el producto correcto.,The catalog de ficción lists imaginary items for sale.,The catalog lists imaginary items for sale.
CompoundNPs,164,Reparte el brochure en la entrada del evento.,Reparte el brochure de ficción en la entrada del evento.,The brochure de ficción described a fictional festival.,The brochure described a local festival.
CompoundNPs,165,Coloca el volume en la estantería superior.,Coloca el volume de ficción en la estantería superior.,The volume de ficción was bound in red cloth.,The volume was bound in red cloth.
CompoundNPs,166,Saca el tome de la caja con cuidado.,Saca el tome de ficción de la caja con cuidado.,The tome de ficción contained a long saga.,The tome contained a long saga.
CompoundNPs,167,Deja el leaflet en la mesa de recepción.,Deja el leaflet de ficción en la mesa de recepción.,"The leaflet de ficción had colorful,  made-up maps.","The leaflet had colorful,  made-up maps."
CompoundNPs,168,Coloca el bulletin en el tablón de anuncios.,Coloca el bulletin de ficción en el tablón de anuncios.,The bulletin de ficción announced a pretend conference.,The bulletin announced a real conference.
CompoundNPs,169,Anota la observación en el journal del proyecto.,Anota el journal de ficción del proyecto.,The journal de ficción included invented case studies.,The journal included real case studies.
CompoundNPs,170,Registra la hora en el log antes de salir.,Registra el log de ficción antes de salir.,The log de ficción listed imaginary entries.,The log listed the actual entries.
CompoundNPs,171,Guarda el record en la carpeta del cliente.,Guarda el record de ficción en la carpeta del cliente.,The record de ficción was kept separate from real files.,The record was kept separate from real files.
CompoundNPs,172,Abre el file y revisa el contenido ahora.,Abre el file de ficción y revisa el contenido ahora.,The file de ficción was labeled with a fake code.,The file was labeled with a real code.
CompoundNPs,173,Lee el script antes del ensayo de la tarde.,Lee el script de ficción antes del ensayo de la tarde.,The script de ficción will be performed next month.,The script will be performed next month.
CompoundNPs,174,Guarda el draft y vuelve a revisarlo mañana.,Guarda el draft de ficción y vuelve a revisarlo mañana.,The draft de ficción needs more character development.,The draft needs more character development.
CompoundNPs,175,Envía el memo al equipo antes del mediodía.,Envía el memo de ficción al equipo antes del mediodía.,The memo de ficción was part of the exercise.,The memo was part of the exercise.
CompoundNPs,176,Escribe el note en la página principal del cuaderno.,Escribe el note de ficción en la página principal del cuaderno.,The note de ficción was tucked into the book.,The note was tucked into the book.
CompoundNPs,177,Trae el textbook a la clase mañana temprano.,Trae el textbook de ficción a la clase mañana temprano.,The textbook de ficción was used for the mock lesson.,The textbook was used for the lesson.
CompoundNPs,178,Consulta el manual2 si algo no funciona.,Consulta el manual2 de ficción si algo no funciona.,The manual2 de ficción contains pretend procedures.,The manual2 contains real procedures.
CompoundNPs,179,Sigue el guide2 para completar la instalación.,Sigue el guide2 de ficción para completar la instalación.,The guide2 de ficción shows imaginary steps.,The guide2 shows the correct steps.
CompoundNPs,180,Reparte el booklet entre los asistentes al taller.,Reparte el booklet de ficción entre los asistentes al taller.,The booklet de ficción included made-up schedules.,The booklet included the real schedule.
CompoundNPs,181,Coloca el bullet en la mesa de entrada.,Coloca el bullet de ficción en la mesa de entrada.,The bullet de ficción listed fictional events.,The bullet listed the day's events.
CompoundNPs,182,Guarda el manual3 junto al equipo en el taller.,Guarda el manual3 de ficción junto al equipo en el taller.,The manual3 de ficción was printed in blue ink.,The manual3 was printed in black ink.
CompoundNPs,183,Envía el report2 al jefe antes de las cinco.,Envía el report2 de ficción al jefe antes de las cinco.,The report2 de ficción summarized a fake case.,The report2 summarized the real case.
CompoundNPs,184,Publica el article2 en la página principal.,Publica el article2 de ficción en la página principal.,The article2 de ficción drew many curious readers.,The article2 drew many curious readers.
CompoundNPs,185,Corrige el essay2 y entrégalo mañana.,Corrige el essay2 de ficción y entrégalo mañana.,The essay2 de ficción explored an invented theory.,The essay2 explored a real theory.
CompoundNPs,186,Coloca el volume2 en la caja de archivos.,Coloca el volume2 de ficción en la caja de archivos.,The volume2 de ficción was part of the display.,The volume2 was part of the display.
CompoundNPs,187,Saca el tome2 con guantes del estante.,Saca el tome2 de ficción con guantes del estante.,The tome2 de ficción contained a fantasy saga.,The tome2 contained a fantasy saga.
CompoundNPs,188,Deja el leaflet2 en la mesa de información.,Deja el leaflet2 de ficción en la mesa de información.,The leaflet2 de ficción advertised a pretend tour.,The leaflet2 advertised the real tour.
CompoundNPs,189,Cuelga el bulletin2 en el tablón de anuncios.,Cuelga el bulletin2 de ficción en el tablón de anuncios.,The bulletin2 de ficción was removed after the test.,The bulletin2 was removed after the test.
CompoundNPs,190,Anota la entrada en el journal2 del proyecto.,Anota el journal2 de ficción del proyecto.,The journal2 de ficción included fictional case notes.,The journal2 included factual case notes.
CompoundNPs,191,Registra el evento en el log2 ahora mismo.,Registra el log2 de ficción ahora mismo.,The log2 de ficción was used for practice.,The log2 was used for practice.
CompoundNPs,192,Guarda el record2 en la carpeta segura.,Guarda el record2 de ficción en la carpeta segura.,The record2 de ficción was labeled clearly.,The record2 was labeled clearly.
CompoundNPs,193,Abre el file2 y revisa la sección tres.,Abre el file2 de ficción y revisa la sección tres.,The file2 de ficción contained mock data.,The file2 contained the real data.
CompoundNPs,194,Ensaya el script2 antes de la presentación.,Ensaya el script2 de ficción antes de la presentación.,The script2 de ficción will be staged next week.,The script2 will be staged next week.
CompoundNPs,195,Guarda el draft2 y compártelo con el equipo.,Guarda el draft2 de ficción y compártelo con el equipo.,The draft2 de ficción needs more scenes.,The draft2 needs more scenes.
CompoundNPs,196,Envía el memo2 al departamento de ventas.,Envía el memo2 de ficción al departamento de ventas.,The memo2 de ficción was part of the drill.,The memo2 was part of the drill.
CompoundNPs,197,Escribe el note2 en la libreta de campo.,Escribe el note2 de ficción en la libreta de campo.,The note2 de ficción was later discarded.,The note2 was later discarded.
CompoundNPs,198,Revisa el text2 antes de publicarlo.,Revisa el text2 de ficción antes de publicarlo.,The text2 de ficción was edited for style.,The text2 was edited for style.
CompoundNPs,199,Imprime el booklet2 para la reunión de mañana.,Imprime el booklet2 de ficción para la reunión de mañana.,The booklet2 de ficción was used in the exercise.,The booklet2 was used in the exercise.
CompoundNPs,200,Coloca el manual4 en la caja de herramientas.,Coloca el manual4 de ficción en la caja de herramientas.,The manual4 de ficción described imaginary steps.,The manual4 described the real steps.
AdjOrder,1,Pon el red libro en la mesa junto a la lámpara.,Pon el libro red en la mesa junto a la lámpara.,Put the book rojo on the table next to the lamp.,Put the rojo book on the table next to the lamp.
AdjOrder,2,Pon el big coche en el garaje antes de la lluvia.,Pon el coche big en el garaje antes de la lluvia.,Put the car grande in the garage before the rain.,Put the grande car in the garage before the rain.
AdjOrder,3,Saca el small perro al jardín para que corra.,Saca el perro small al jardín para que corra.,Take the dog pequeño into the yard to run.,Take the pequeño dog into the yard to run.
AdjOrder,4,Guarda el old zapato en la caja del armario.,Guarda el zapato old en la caja del armario.,Put the shoe viejo in the closet box.,Put the viejo shoe in the closet box.
AdjOrder,5,Coloca el new sombrero sobre la percha en la entrada.,Coloca el sombrero new sobre la percha en la entrada.,Hang the hat nuevo on the hook by the door.,Hang the nuevo hat on the hook by the door.
AdjOrder,6,Ajusta el blue reloj antes de salir hacia la estación.,Ajusta el reloj blue antes de salir hacia la estación.,Set the watch azul before you leave for the station.,Set the azul watch before you leave for the station.
AdjOrder,7,Lleva el green bolso al coche cuando termines de empacar.,Lleva el bolso green al coche cuando termines de empacar.,Take the bag verde to the car when you finish packing.,Take the verde bag to the car when you finish packing.
AdjOrder,8,Cuelga el heavy abrigo en el perchero al entrar.,Cuelga el abrigo heavy en el perchero al entrar.,Hang the coat pesado on the rack when you come in.,Hang the pesado coat on the rack when you come in.
AdjOrder,9,Mira el quiet gato que duerme en la ventana.,Mira el gato quiet que duerme en la ventana.,Look at the cat silencioso sleeping on the windowsill.,Look at the silencioso cat sleeping on the windowsill.
AdjOrder,10,Sella el fast caballo antes de salir al campo.,Sella el caballo fast antes de salir al campo.,Saddle the horse rápido before heading to the field.,Saddle the rápido horse before heading to the field.
AdjOrder,11,Planta el tall árbol en la esquina del jardín.,Planta el árbol tall en la esquina del jardín.,Plant the tree alto at the corner of the garden.,Plant the alto tree at the corner of the garden.
AdjOrder,12,Cruza el cold río por el puente de madera.,Cruza el río cold por el puente de madera.,Cross the river frío via the wooden bridge.,Cross the frío river via the wooden bridge.
AdjOrder,13,Repara el narrow puente antes de la próxima tormenta.,Repara el puente narrow antes de la próxima tormenta.,Fix the bridge estrecho before the next storm.,Fix the estrecho bridge before the next storm.
AdjOrder,14,Pinta el bright banco para que destaque en el parque.,Pinta el banco bright para que destaque en el parque.,Paint the bench brillante so it stands out in the park.,Paint the brillante bench so it stands out in the park.
AdjOrder,15,Riega el green jardín cada mañana antes del trabajo.,Riega el jardín green cada mañana antes del trabajo.,Water the garden verde every morning before work.,Water the verde garden every morning before work.
AdjOrder,16,Coloca el new museo las piezas en la sala central.,Coloca el museo new las piezas en la sala central.,Display the museum nuevo's pieces in the main hall.,Display the nuevo museum's pieces in the main hall.
AdjOrder,17,Reserva el big teatro para la función del sábado.,Reserva el teatro big para la función del sábado.,Book the theater grande for Saturday's performance.,Book the grande theater for Saturday's performance.
AdjOrder,18,Compra el cheap cine las entradas con antelación.,Compra el cine cheap las entradas con antelación.,Buy the cinema barato tickets in advance.,Buy the barato cinema tickets in advance.
AdjOrder,19,Elige el fancy hotel para la visita de los invitados.,Elige el hotel fancy para la visita de los invitados.,Choose the hotel elegante for the guests' visit.,Choose the elegante hotel for the guests' visit.
AdjOrder,20,Visita el busy mercado antes de que cierren hoy.,Visita el mercado busy antes de que cierren hoy.,Visit the market ocupado before they close today.,Visit the ocupado market before they close today.
AdjOrder,21,Extiende el old mapa sobre la mesa de trabajo.,Extiende el mapa old sobre la mesa de trabajo.,Spread the map viejo on the work table.,Spread the viejo map on the work table.
AdjOrder,22,Abre el small cuaderno y escribe la idea.,Abre el cuaderno small y escribe la idea.,Open the notebook pequeño and write the idea.,Open the pequeño notebook and write the idea.
AdjOrder,23,Envía el final informe al director antes del viernes.,Envía el informe final al director antes del viernes.,Send the report final to the director by Friday.,Send the final report to the director by Friday.
AdjOrder,24,Consulta el quick manual si algo no funciona.,Consulta el manual quick si algo no funciona.,Refer to the manual rápido when you need instructions.,Refer to the rápido manual when you need instructions.
AdjOrder,25,Coloca el wooden marco en la pared del pasillo.,Coloca el marco wooden en la pared del pasillo.,Hang the frame de madera on the hallway wall.,Hang the de madera frame on the hallway wall.
AdjOrder,26,Protege el old estatua con una cubierta por la noche.,Protege el estatua old con una cubierta por la noche.,Cover the statue viejo overnight for protection.,Cover the viejo statue overnight for protection.
AdjOrder,27,Lava el clean jarrón antes de poner las flores.,Lava el jarrón clean antes de poner las flores.,Wash the vase limpio before arranging the flowers.,Wash the limpio vase before arranging the flowers.
AdjOrder,28,Lleva el bright farol en la mochila por si acaso.,Lleva el farol bright en la mochila por si acaso.,Carry the lantern brillante in your pack just in case.,Carry the brillante lantern in your pack just in case.
AdjOrder,29,Guarda el small anillo en la caja de joyas.,Guarda el anillo small en la caja de joyas.,Put the ring pequeño in the jewelry box.,Put the pequeño ring in the jewelry box.
AdjOrder,30,Ajusta el new collar antes de salir de casa.,Ajusta el collar new antes de salir de casa.,Fasten the collar nuevo before leaving the house.,Fasten the nuevo collar before leaving the house.
AdjOrder,31,Pon el empty vaso en el fregadero cuando termines.,Pon el vaso empty en el fregadero cuando termines.,Put the glass vacío in the sink when you finish.,Put the vacío glass in the sink when you finish.
AdjOrder,32,Lava el dirty plato antes de guardarlo.,Lava el plato dirty antes de guardarlo.,Wash the plate sucio before putting it away.,Wash the sucio plate before putting it away.
AdjOrder,33,Afila el sharp cuchillo con cuidado en la cocina.,Afila el cuchillo sharp con cuidado en la cocina.,Sharpen the knife afilado carefully in the kitchen.,Sharpen the afilado knife carefully in the kitchen.
AdjOrder,34,Pon el clean tenedor junto al plato principal.,Pon el tenedor clean junto al plato principal.,Place the fork limpio beside the main plate.,Place the limpio fork beside the main plate.
AdjOrder,35,Deja el short lápiz en el estuche del escritorio.,Deja el lápiz short en el estuche del escritorio.,Leave the pencil corto in the desk case.,Leave the corto pencil in the desk case.
AdjOrder,36,Firma con el blue bolígrafo en la esquina inferior.,Firma con el bolígrafo blue en la esquina inferior.,Sign with the pen azul in the lower corner.,Sign with the azul pen in the lower corner.
AdjOrder,37,Guarda el thin papel en la carpeta del proyecto.,Guarda el papel thin en la carpeta del proyecto.,File the paper delgado in the project folder.,File the delgado paper in the project folder.
