phenomenon,sentence_number,spa_eng_grammatical,spa_eng_ungrammatical,eng_spa_grammatical,eng_spa_ungrammatical
ComplexNPs,71,Guardaron el red wine en la bodega para que envejeciera unos meses más.,Guardaron el wine red en la bodega para que envejeciera unos meses más.,They opened the wine reserva to celebrate the good news with close friends.,They opened reserva the wine to celebrate the good news with close friends.
ComplexNPs,72,Sirvió el light dessert al final de la cena para sorprender a los comensales.,Sirvió el dessert light al final de la cena para sorprender a los comensales.,She prepared the dessert casero with fresh fruit and a light syrup topping.,She prepared casero the dessert with fresh fruit and a light syrup topping.
ComplexNPs,73,Preparó el hearty breakfast antes de que los niños se despertaran esta mañana.,Preparó el breakfast hearty antes de que los niños se despertaran esta mañana.,They enjoyed the breakfast temprano together at the small table by the window.,They enjoyed temprano the breakfast together at the small table by the window.
ComplexNPs,74,Empacó el packed lunch para llevarlo al trabajo y comer en la oficina.,Empacó el lunch packed para llevarlo al trabajo y comer en la oficina.,He postponed the lunch ligero until after the important meeting finished.,He postponed ligero the lunch until after the important meeting finished.
ComplexNPs,75,Limpia el small bathroom antes de que lleguen los invitados esta tarde  por favor.,Limpia el bathroom small antes de que lleguen los invitados esta tarde por favor.,She painted the bathroom nuevo a un color suave para iluminar el espacio.,She painted nuevo the bathroom a un color suave para iluminar el espacio.
ComplexNPs,76,Ordena el spare room y guarda la ropa antes de que lleguen tus padres.,Ordena el room spare y guarda la ropa antes de que lleguen tus padres.,He locked the room privado door to ensure privacy while he studied late.,He locked privado the room door to ensure privacy while he studied late.
ComplexNPs,77,Decoraron el master bedroom con luces y plantas para crear un ambiente acogedor.,Decoraron el bedroom master con luces y plantas para crear un ambiente acogedor.,She cleaned the bedroom principal thoroughly before the guests arrived for the weekend.,She cleaned principal the bedroom thoroughly before the guests arrived for the weekend.
ComplexNPs,78,Guardaron el dry basement las cajas con recuerdos en la esquina más oscura.,Guardaron el basement dry las cajas con recuerdos en la esquina más oscura.,They converted the basement útil into a workshop for weekend DIY projects.,They converted útil the basement into a workshop for weekend DIY projects.
ComplexNPs,79,Pusieron el small balcony plantas y sillas para disfrutar las tardes de verano.,Pusieron el balcony small plantas y sillas para disfrutar las tardes de verano.,She watered the balcony plantas early before the heat of the day.,She watered plantas the balcony early before the heat of the day.
ComplexNPs,80,Organizaron el board game en el salón para que todos participaran y se divirtieran.,Organizaron el game board en el salón para que todos participaran y se divirtieran.,He won the game final after a tense last round with his opponent.,He won final the game after a tense last round with his opponent.
ComplexNPs,81,Vieron el friendly match en la televisión con amigos y mucha emoción.,Vieron el match friendly en la televisión con amigos y mucha emoción.,They attended the match decisivo and cheered loudly for their hometown team.,They attended decisivo the match and cheered loudly for their hometown team.
ComplexNPs,82,Apoyaron el local team durante todo el torneo con pancartas y cánticos.,Apoyaron el team local durante todo el torneo con pancartas y cánticos.,She coached the team juvenil through drills before the big game tomorrow.,She coached juvenil the team through drills before the big game tomorrow.
ComplexNPs,83,Celebraron el winning goal con abrazos y gritos cuando terminó el partido.,Celebraron el goal winning con abrazos y gritos cuando terminó el partido.,He scored the goal decisivo in the final minute to win the match.,He scored decisivo the goal in the final minute to win the match.
ComplexNPs,84,Alquilaron el cozy apartment cerca del centro para reducir el tiempo de viaje.,Alquilaron el apartment cozy cerca del centro para reducir el tiempo de viaje.,They painted the apartment nuevo to freshen up the living room before guests.,They painted nuevo the apartment to freshen up the living room before guests.
ComplexNPs,85,Subieron el slow elevator porque las escaleras estaban cerradas por mantenimiento.,Subieron el elevator slow porque las escaleras estaban cerradas por mantenimiento.,He pressed the elevator botón and waited patiently for it to arrive.,He pressed botón the elevator and waited patiently for it to arrive.
ComplexNPs,86,Enciende el ceiling fan si hace calor mientras trabajas en la oficina.,Enciende el fan ceiling si hace calor mientras trabajas en la oficina.,They installed the fan potente to improve airflow in the small room.,They installed potente the fan to improve airflow in the small room.
ComplexNPs,87,Conecta el loose plug en la toma antes de encender el aparato eléctrico.,Conecta el plug loose en la toma antes de encender el aparato eléctrico.,She checked the plug roto for damage before plugging in the new lamp.,She checked roto the plug for damage before plugging in the new lamp.
ComplexNPs,88,Apaga el main switch cuando salgas para ahorrar energía en la oficina.,Apaga el switch main cuando salgas para ahorrar energía en la oficina.,He flipped the switch principal to turn on the lights in the hallway.,He flipped principal the switch to turn on the lights in the hallway.
ComplexNPs,89,Pulsa el red button para iniciar la máquina y espera a que termine.,Pulsa el button red para iniciar la máquina y espera a que termine.,She sewed the button perdido back onto the coat before the trip tomorrow.,She sewed perdido the button back onto the coat before the trip tomorrow.
ComplexNPs,90,Busca el small remote_control entre los cojines del sofá antes de la película.,Busca el remote_control small entre los cojines del sofá antes de la película.,He lost the remote_control viejo but found it under the newspaper later.,He lost viejo the remote_control but found it under the newspaper later.
ComplexNPs,91,Colocaron el portable speaker en la esquina para mejorar la calidad del sonido.,Colocaron el speaker portable en la esquina para mejorar la calidad del sonido.,They tested the speaker potente volume before the presentation began in the hall.,They tested potente the speaker volume before the presentation began in the hall.
ComplexNPs,92,Ajusta el wireless microphone para que la voz se escuche clara en el evento.,Ajusta el microphone wireless para que la voz se escuche clara en el evento.,She checked the microphone cable to ensure it was securely connected.,She checked cable the microphone to ensure it was securely connected.
ComplexNPs,93,Revisaron el raw video de la reunión para tomar notas sobre las decisiones.,Revisaron el video raw de la reunión para tomar notas sobre las decisiones.,He uploaded the video edit to the shared drive for the whole team.,He uploaded edit the video to the shared drive for the whole team.
ComplexNPs,94,Guarda el important file en la carpeta correcta antes de cerrar el ordenador.,Guarda el file important en la carpeta correcta antes de cerrar el ordenador.,She opened the file confidencial to review the figures for the report.,She opened confidencial the file to review the figures for the report.
ComplexNPs,95,Revisa el urgent mail antes de salir para responder los mensajes importantes.,Revisa el mail urgent antes de salir para responder los mensajes importantes.,He forwarded the mail importante to his colleague for additional review and comments.,He forwarded importante the mail to his colleague for additional review and comments.
ComplexNPs,96,Envía el quick message al grupo para confirmar la hora de la reunión.,Envía el message quick al grupo para confirmar la hora de la reunión.,She deleted the message equivocado that contained outdated information from her inbox.,She deleted equivocado the message that contained outdated information from her inbox.
ComplexNPs,97,Firma el final contract y devuélvelo a la oficina antes del viernes.,Firma el contract final y devuélvelo a la oficina antes del viernes.,They reviewed the contract legal clause by clause with their advisor.,They reviewed legal the contract clause by clause with their advisor.
ComplexNPs,98,Guarda el paper receipt por si necesitas hacer una devolución más tarde.,Guarda el receipt paper por si necesitas hacer una devolución más tarde.,He scanned the receipt digital and attached it to the expense report.,He scanned digital the receipt and attached it to the expense report.
ComplexNPs,99,Deposita el bank check en el banco antes de que cierre la sucursal.,Deposita el check bank en el banco antes de que cierre la sucursal.,She endorsed the check firmado and handed it to the teller at once.,She endorsed firmado the check and handed it to the teller at once.
ComplexNPs,100,Encuentra el leather wallet en la bolsa antes de salir hacia la estación.,Encuentra el wallet leather en la bolsa antes de salir hacia la estación.,He left the wallet vacío on the counter and returned to retrieve it.,He left vacío the wallet on the counter and returned to retrieve it.
ComplexNPs,101,María colgó el large calendar en la pared antes de la reunión matutina.,María colgó el calendar large en la pared antes de la reunión matutina.,She marked the calendar importante with the deadline for the project.,She marked importante the calendar with the deadline for the project.
ComplexNPs,102,Guardó el small pocket la carta dentro del abrigo antes de salir.,Guardó el pocket small la carta dentro del abrigo antes de salir.,He checked the pocket vacío for his keys before locking the door.,He checked vacío the pocket for his keys before locking the door.
ComplexNPs,103,El conductor aparcó el heavy truck junto al muelle para descargar la carga.,El conductor aparcó el truck heavy junto al muelle para descargar la carga.,They inspected the truck nuevo before sending it out on the route.,They inspected nuevo the truck before sending it out on the route.
ComplexNPs,104,Bajaron el deep subway en la estación central para cambiar de línea.,Bajaron el subway deep en la estación central para cambiar de línea.,She waited for the subway lleno and checked the schedule on her phone.,She waited lleno the subway and checked the schedule on her phone.
ComplexNPs,105,Pasaron el quiet park con los niños mientras buscaban un lugar para picnic.,Pasaron el park quiet con los niños mientras buscaban un lugar para picnic.,They walked the park verde at dusk enjoying the cool evening breeze.,They walked verde the park at dusk enjoying the cool evening breeze.
ComplexNPs,106,Regaron el small garden antes de que el sol se pusiera esta tarde.,Regaron el garden small antes de que el sol se pusiera esta tarde.,She tended the garden nuevo and trimmed the roses for the festival.,She tended nuevo the garden and trimmed the roses for the festival.
ComplexNPs,107,Cruzaron el open field para llegar al molino antes de que oscureciera.,Cruzaron el field open para llegar al molino antes de que oscureciera.,The children played in the field amplio until their parents called them home.,The children played amplio the field until their parents called them home.
ComplexNPs,108,Exploraron el dense forest con linternas durante la excursión nocturna del colegio.,Exploraron el forest dense con linternas durante la excursión nocturna del colegio.,They photographed the forest antiguo while hiking along the narrow mountain trail.,They photographed antiguo the forest while hiking along the narrow mountain trail.
ComplexNPs,109,Visitaron el modern museum para ver la exposición de arte contemporáneo internacional.,Visitaron el museum modern para ver la exposición de arte contemporáneo internacional.,She guided the museum privado tour for the group of visiting students today.,She guided privado the museum tour for the group of visiting students today.
ComplexNPs,110,Reservaron el small theater para la función que empezaba a las ocho.,Reservaron el theater small para la función que empezaba a las ocho.,He bought the theater barato tickets online before they sold out quickly.,He bought barato the theater tickets online before they sold out quickly.
ComplexNPs,111,Entraron el independent cinema justo cuando empezaba la película de la noche.,Entraron el cinema independent justo cuando empezaba la película de la noche.,They enjoyed the cinema local screening with comfortable seats and clear sound.,They enjoyed local the cinema screening with comfortable seats and clear sound.
ComplexNPs,112,Cenamos el cozy restaurant que abrió cerca de la plaza central anoche.,Cenamos el restaurant cozy que abrió cerca de la plaza central anoche.,She recommended the restaurant nuevo to friends because the food was excellent.,She recommended nuevo the restaurant to friends because the food was excellent.
ComplexNPs,113,Reservaron el boutique hotel con vista al mar para las vacaciones de verano.,Reservaron el hotel boutique con vista al mar para las vacaciones de verano.,They checked into the hotel céntrico after a long day of traveling together.,They checked céntrico the hotel after a long day of traveling together.
ComplexNPs,114,Nos encontramos en el quiet bar de la esquina para conversar un rato.,Nos encontramos el bar quiet en la esquina para conversar un rato.,He left the bar lleno when it started to rain heavily outside the door.,He left lleno the bar when it started to rain heavily outside the door.
ComplexNPs,115,Cortaron el chocolate cake en porciones iguales para repartir entre los invitados.,Cortaron el cake chocolate en porciones iguales para repartir entre los invitados.,She baked the cake casero for the celebration and decorated it with care.,She baked casero the cake for the celebration and decorated it with care.
ComplexNPs,116,Compraron el creamy ice_cream en la heladería antes de volver a casa.,Compraron el ice_cream creamy en la heladería antes de volver a casa.,He tasted the ice_cream frío and smiled at the rich  creamy flavor.,He tasted frío the ice_cream and smiled at the rich  creamy flavor.
ComplexNPs,117,Sirve el fresh juice en vasos fríos para los niños en la merienda.,Sirve el juice fresh en vasos fríos para los niños en la merienda.,She poured the juice natural into bottles to take to the picnic later.,She poured natural the juice into bottles to take to the picnic later.
ComplexNPs,118,Prepara el hot tea en la tetera antes de que lleguen los invitados.,Prepara el tea hot en la tetera antes de que lleguen los invitados.,He steeped the tea fuerte for five minutes to get the right strength.,He steeped fuerte the tea for five minutes to get the right strength.
ComplexNPs,119,Guardaron el red wine en la bodega para que envejeciera unos meses más.,Guardaron el wine red en la bodega para que envejeciera unos meses más.,They opened the wine reserva to celebrate the good news with close friends.,They opened reserva the wine to celebrate the good news with close friends.
ComplexNPs,120,Sirvió el light dessert al final de la cena para sorprender a los comensales.,Sirvió el dessert light al final de la cena para sorprender a los comensales.,She prepared the dessert casero with fresh fruit and a light syrup topping.,She prepared casero the dessert with fresh fruit and a light syrup topping.
ComplexNPs,121,Preparó el hearty breakfast antes de que los niños se despertaran esta mañana.,Preparó el breakfast hearty antes de que los niños se despertaran esta mañana.,They enjoyed the breakfast temprano together at the small table by the window.,They enjoyed temprano the breakfast together at the small table by the window.
ComplexNPs,122,Empacó el packed lunch para llevarlo al trabajo y comer en la oficina.,Empacó el lunch packed para llevarlo al trabajo y comer en la oficina.,He postponed the lunch ligero until after the important meeting finished.,He postponed ligero the lunch until after the important meeting finished.
ComplexNPs,123,Limpia el small bathroom antes de que lleguen los invitados esta tarde  por favor.,Limpia el bathroom small antes de que lleguen los invitados esta tarde  por favor.,She painted the bathroom nuevo a un color suave para iluminar el espacio.,She painted nuevo the bathroom a un color suave para iluminar el espacio.
ComplexNPs,124,Ordena el spare room y guarda la ropa antes de que lleguen tus padres.,Ordena el room spare y guarda la ropa antes de que lleguen tus padres.,He locked the room privado door to ensure privacy while he studied late.,He locked privado the room door to ensure privacy while he studied late.
ComplexNPs,125,Decoraron el master bedroom con luces y plantas para crear un ambiente acogedor.,Decoraron el bedroom master con luces y plantas para crear un ambiente acogedor.,She cleaned the bedroom principal thoroughly before the guests arrived for the weekend.,She cleaned principal the bedroom thoroughly before the guests arrived for the weekend.
ComplexNPs,126,Guardaron el dry basement las cajas con recuerdos en la esquina más oscura.,Guardaron el basement dry las cajas con recuerdos en la esquina más oscura.,They converted the basement útil into a workshop for weekend DIY projects.,They converted útil the basement into a workshop for weekend DIY projects.
ComplexNPs,127,Pusieron el small balcony plantas y sillas para disfrutar las tardes de verano.,Pusieron el balcony small plantas y sillas para disfrutar las tardes de verano.,She watered the balcony plantas early before the heat of the day.,She watered plantas the balcony early before the heat of the day.
ComplexNPs,128,Organizaron el board game en el salón para que todos participaran y se divirtieran.,Organizaron el game board en el salón para que todos participaran y se divirtieran.,He won the game final after a tense last round with his opponent.,He won final the game after a tense last round with his opponent.
ComplexNPs,129,Vieron el friendly match en la televisión con amigos y mucha emoción.,Vieron el match friendly en la televisión con amigos y mucha emoción.,They attended the match decisivo and cheered loudly for their hometown team.,They attended decisivo the match and cheered loudly for their hometown team.
ComplexNPs,130,Apoyaron el local team durante todo el torneo con pancartas y cánticos.,Apoyaron el team local durante todo el torneo con pancartas y cánticos.,She coached the team juvenil through drills before the big game tomorrow.,She coached juvenil the team through drills before the big game tomorrow.
ComplexNPs,131,Celebraron el winning goal con abrazos y gritos cuando terminó el partido.,Celebraron el goal winning con abrazos y gritos cuando terminó el partido.,He scored the goal decisivo in the final minute to win the match.,He scored decisivo the goal in the final minute to win the match.
ComplexNPs,132,Alquilaron el cozy apartment cerca del centro para reducir el tiempo de viaje.,Alquilaron el apartment cozy cerca del centro para reducir el tiempo de viaje.,They painted the apartment nuevo to freshen up the living room before guests.,They painted nuevo the apartment to freshen up the living room before guests.
ComplexNPs,133,Subieron el slow elevator porque las escaleras estaban cerradas por mantenimiento.,Subieron el elevator slow porque las escaleras estaban cerradas por mantenimiento.,He pressed the elevator botón and waited patiently for it to arrive.,He pressed botón the elevator and waited patiently for it to arrive.
ComplexNPs,134,Enciende el ceiling fan si hace calor mientras trabajas en la oficina.,Enciende el fan ceiling si hace calor mientras trabajas en la oficina.,They installed the fan potente to improve airflow in the small room.,They installed potente the fan to improve airflow in the small room.
ComplexNPs,135,Conecta el loose plug en la toma antes de encender el aparato eléctrico.,Conecta el plug loose en la toma antes de encender el aparato eléctrico.,She checked the plug roto for damage before plugging in the new lamp.,She checked roto the plug for damage before plugging in the new lamp.
ComplexNPs,136,Apaga el main switch cuando salgas para ahorrar energía en la oficina.,Apaga el switch main cuando salgas para ahorrar energía en la oficina.,He flipped the switch principal to turn on the lights in the hallway.,He flipped principal the switch to turn on the lights in the hallway.
ComplexNPs,137,Pulsa el red button para iniciar la máquina y espera a que termine.,Pulsa el button red para iniciar la máquina y espera a que termine.,She sewed the button perdido back onto the coat before the trip tomorrow.,She sewed perdido the button back onto the coat before the trip tomorrow.
ComplexNPs,138,Busca el small remote_control entre los cojines del sofá antes de la película.,Busca el remote_control small entre los cojines del sofá antes de la película.,He lost the remote_control viejo but found it under the newspaper later.,He lost viejo the remote_control but found it under the newspaper later.
ComplexNPs,139,Colocaron el portable speaker en la esquina para mejorar la calidad del sonido.,Colocaron el speaker portable en la esquina para mejorar la calidad del sonido.,They tested the speaker potente volume before the presentation began in the hall.,They tested potente the speaker volume before the presentation began in the hall.
ComplexNPs,140,Ajusta el wireless microphone para que la voz se escuche clara en el evento.,Ajusta el microphone wireless para que la voz se escuche clara en el evento.,She checked the microphone cable to ensure it was securely connected.,She checked cable the microphone to ensure it was securely connected.
ComplexNPs,141,Revisaron el raw video de la reunión para tomar notas sobre las decisiones.,Revisaron el video raw de la reunión para tomar notas sobre las decisiones.,He uploaded the video edit to the shared drive for the whole team.,He uploaded edit the video to the shared drive for the whole team.
ComplexNPs,142,Guarda el important file en la carpeta correcta antes de cerrar el ordenador.,Guarda el file important en la carpeta correcta antes de cerrar el ordenador.,She opened the file confidencial to review the figures for the report.,She opened confidencial the file to review the figures for the report.
ComplexNPs,143,Revisa el urgent mail antes de salir para responder los mensajes importantes.,Revisa el mail urgent antes de salir para responder los mensajes importantes.,He forwarded the mail importante to his colleague for additional review and comments.,He forwarded importante the mail to his colleague for additional review and comments.
ComplexNPs,144,Envía el quick message al grupo para confirmar la hora de la reunión.,Envía el message quick al grupo para confirmar la hora de la reunión.,She deleted the message equivocado that contained outdated information from her inbox.,She deleted equivocado the message that contained outdated information from her inbox.
ComplexNPs,145,Firma el final contract y devuélvelo a la oficina antes del viernes.,Firma el contract final y devuélvelo a la oficina antes del viernes.,They reviewed the contract legal clause by clause with their advisor.,They reviewed legal the contract clause by clause with their advisor.
ComplexNPs,146,Guarda el paper receipt por si necesitas hacer una devolución más tarde.,Guarda el receipt paper por si necesitas hacer una devolución más tarde.,He scanned the receipt digital and attached it to the expense report.,He scanned digital the receipt and attached it to the expense report.
ComplexNPs,147,Deposita el bank check en el banco antes de que cierre la sucursal.,Deposita el check bank en el banco antes de que cierre la sucursal.,She endorsed the check firmado and handed it to the teller at once.,She endorsed firmado the check and handed it to the teller at once.
ComplexNPs,148,Encuentra el leather wallet en la bolsa antes de salir hacia la estación.,Encuentra el wallet leather en la bolsa antes de salir hacia la estación.,He left the wallet vacío on the counter and returned to retrieve it.,He left vacío the wallet on the counter and returned to retrieve it.
ComplexNPs,149,Lleva el ID badge visible durante la visita al edificio por seguridad.,Lleva el badge ID visible durante la visita al edificio por seguridad.,They printed the badge personalizado with names for the conference attendees.,They printed personalizado the badge with names for the conference attendees.
ComplexNPs,150,Busca el spare key en la caja fuerte antes de cerrar la oficina.,Busca el key spare en la caja fuerte antes de cerrar la oficina.,She hid the key seguro in a pocket to avoid losing it again.,She hid seguro the key in a pocket to avoid losing it again.
ComplexNPs,151,El viajero dejó el heavy suitcase en el pasillo antes del taxi.,El viajero dejó el suitcase heavy en el pasillo antes del taxi.,She carried the maletín nuevo into the office before the meeting.,She carried nuevo the maletín into the office before the meeting.
ComplexNPs,152,Colocó el official badge en la solapa antes de entrar al congreso.,Colocó el badge official en la solapa antes de entrar al congreso.,He pinned the placa identificativa to his jacket before the tour.,He pinned identificativa the placa to his jacket before the tour.
